,season,episode,Rating,Name,Date,Text,Useful
3,8,12,6,Sarbear112004,20 January 2012,"The episodes are getting better and better as the season goes on however it's still hard to watch. I love how Jim is pranking again and also Robert California is becoming more and more tolerable and likable however we need to bring back Pam! It's just not the same without her. I know the actress is on maternity leave but couldn't they do more with her before she left? I mean seriously last time (when her character was out for Cece) they had her voice on phone calls, Jenna Fisher added a lot to the show that I didn't realize until she was gone. It's sad that Michael left and I wish he would come back but that's not likely either. I don't know about everyone else but I like the Andy Erin relationship but Erin has just gotten weird! I also liked the comedy that Angela and Dwighy brought to the table I thought it would be funny if she ended up saying Dwights the real father of her baby...and isn't Angela's senator husband gay anyway?",6/40
0,8,14,8,ComedyFan2010,4 February 2019,"Dwight organizes a team to go to Florida.Loved Dwight's Perfectenschlag. Great team. Although I was hoping that Kelly will go, but seems that Ryan made a perfect presentation. Stanley was awesome though, he sure needs to go to Florida! And I guess this is why Kathy is in, to go after Jim.",9/9
1,8,14,8,vivianla,18 February 2021,Pam has come back from maternity leave and looks bigger than Angela. Angela has also come back and everyone praises her body and she has brought her baking in. Pam asks how she has time and Angela says babies sleep a lot if you feed them enough.Andy lets Dwight know he is to lead the special projects group and they are to go to Florida to help create a retail store for Sabre.Dwight wants competent workers but Andy does not want the most essential workers to leave. Andy offers a Meredith.Cathy is suspiciously on the phone talking about how bad the Halperts' marriage is. What else are they to do during the three weeks in Florida? Sounds like she plans on being with Jim.,1/3
2,8,14,10,theteamavengers,24 June 2020,Honestly this ia one of the best episodes in the office and season 8 is way too much overhated. I'm enjoying it so far. This episode will make you excited for the others,18/22
0,8,16,9,ComedyFan2010,4 February 2019,"Dwight tries to become VPI liked the opening of the episode, especially Angela saying that pets aren't kids. Considering that this is how she always treated her cats. Dwight was great in this episode. Kathy hitting on Jim was also fun, his reactions and also how Dwight got rid of her. Him staying over with Dwight was also a good ending.",30/30
1,8,16,8,vivianla,20 February 2021,Dwight tries to out-seduce Packer.Cathy tries to seduce Jim by going to his room and going to his bed and bending over to grab from the fridge. She takes a shower in his room.Back in Scranton the office has to stay after normal work hours to make up for the work of the missing workers. They gather in the conference room and have an assembly line.,3/6
2,8,16,9,Faristuta,8 June 2020,"I was gonna give this episode an 8, but when they revealed that Gabe's middle name is Susan, I had to bump it to 9.",27/29
3,8,16,10,alotaibeabdulaziz,26 June 2020,"Jim and Dwight's friendship is great,I loved it,dwight and todd packer's competition is good because of dwight,todd packer is annoying",35/36
0,8,18,9,ComedyFan2010,4 February 2019,Robert California wants to stop the store and fire the vice president. Jim wants to warn Dwight.Loved the Dwight and Jim story. Their fight was fun and the reason behind it is so incredibly sweet! Darryl and Toby competing who will sell Kevin cookies was also great to watch.,11/13
1,8,18,8,vivianla,20 February 2021,Dwight and the receptionist plan on staying in Florida. Dwight is the VP and the receptionist has been hired as a live-in nanny for an old woman she met at the Sabre opening.Pam insists Jim go back to try again. To tell Dwight that Robert plans on firing and vetoing the store.Jim and Dwight have a wrestling match then Dwight enters the room only to hear that Packer (who stepped in as VP) was to be fired and the store to be closed. Dwight walks back out and shakes hands with Jim as a thank you.Back in the office Jim asks Kelly if she lost weight and she says thank you for someone who notices. She actually did not and said she contoured her face to make it smaller and she gained 5 lbs actually.,2/3
2,8,18,10,samratsingraur,1 November 2020,The show continues to make us laugh at every point even though Michael Scott left and thing about later seasons is that we actually get to see the love part between Jim and Dwight relation. Im so impressed that the show didn't lose itself or fails to be comedic after 7 incredibly hilarious seasons.,5/18
3,8,18,4,mptrager,15 June 2021,"Positive:Kevin always brings a smile to my face and I love the Daryl, Toby, Kevin story in this episode.I still like Robert California.Sad Stanley leaving Florida.Negative:Dwight. What the heck in this episode. Being beligerent for the heck of it for no reason. 8+ years and you'd think he'd give Jim like 2 seconds especially if he is being so serious. They are friends. Just dumb.The really horribly filmed or edited ""delaying"" fight scene is like the worst slap stick ""comedy"" the show has done.Erin is just so dumb, like it's not even realistic. It's for comedic reasons but seriously... What? ""I boiled some Gatorade."" Huh?The end.",5/9
0,8,20,6,ComedyFan2010,4 February 2019,The office throws a welcome party for Nellie.The only really good thing in this episode was the opening with Stanley's mustache. I wasn't sure he has one myself! The break up part was not really funny. And it was disappointing that Jim tried to save Nellie's party. So what she had a bad break up. Who didn't. She sucks. She will only be good for the show if she isn't there or if something mean is one to her.,26/27
1,8,20,8,vivianla,24 February 2021,Andy and Erin drive to Jessica's cottage. Turns out her friends are having a bachelorette party and there are penis gummies.Nellie shows up to work late and is confronted by Robert who dismissed it as stress. He insists Jim and Dwight help her with moving boxes and that they throw a party for her at the end of the day. No one likes Nellie and decides to throw a party with subtle hints of disliking her.Jim learns that she has an ex who is a magician and feels bad.,1/6
2,8,20,7,niyahsnewacc,1 May 2021,I miss actually laughing while I'm watching the office. I don't know what's going on with this show but I'm not enjoying it. Nellies gotta go and her character pisses me off. I'm really hoping this show starts to improve soon because it's losing me.,4/5
3,8,20,1,BoredNow33,29 April 2020,Someone broke up with you. So now we should feel sorry for you and like you? No! Nellie is horrible! How could anyone think this character is a good idea? And really?!? Let's call her Pam? That was ridiculous! It is just stupid!,29/33
4,8,20,4,adumbgaming,20 November 2021,"It's like they're challenging me on which plot to hate more, the A or the B plot. At least the cold open was funny but that seems to be most of the episodes this season.",4/4
5,8,20,4,richieyo2000-228-95687,24 April 2018,"Finally... I thought there was a funny episode and a decent comedy situation by throwing Nelly a ""unwelcome"" party (a party that would totally humiliate her). It was was great until jim and Dwight came across some old photos of Nelly's ex-boyfriend. hoping they would post them up on the vending machines, jim totally throws the plot by becoming all wishy washy (which is so unlike Jim) on Nelly's broken hearted past. this is when the episode jumped the shark on itself. I've never seen such a thing. If this is what the writers were shooting for then they're geniuses. What a total rip!",13/18
0,8,22,7,ComedyFan2010,4 February 2019,Andy comes to the fundraiser.Well this episode was not as good as the last one but also not as bad as the previous ones. It had good moments. I like the story with Angela's husband. Jim getting the number was pretty good. Dwight with his winnings made me laugh as well. And it was great to see David Wallace again. So glad his stupid toy ended up working out!,13/16
1,8,22,8,vivianla,26 February 2021,Andy is Erin's date for the fundraiser for dogs. However he ends up declaring he will adopt all eleven dogs.I died when Kevin described his dog doing nothing. Doesn't eat or poop and he has to open her eyes. She also smells terrible.,3/5
2,8,22,3,francogrex,20 July 2021,"I am watching the series in 2021, starting from S1E1 onward. When back in season 7 Michael (the main character, actor Steve Carell) had left the show, I thought, ok it was dead, but then we realized that some of the remaining cast like Jim and Dwight, and Andy (Ed Helms) all great actors, were capable to continue holding the fort. In addition they brought in heavy weights in acting like James Spader (albeit pre-blacklist), etc, so ok we thought maybe it could stand on its own as such. But starting from this episode, for me, I realized, that's it, they're broke and they've had their moments, it's about time this goes to bed. So it doesn't surprise me that this is one of just a few episodes before season 9 which was the last season. That being said, I am writing this negative review and I know the review process is inherently biased, because if I am giving this episode and maybe the next few ones < 5/10, but the previous 7 seasons, 100s of episodes would have gotten 10/10 for me, they were great (I just couldn't be ar*ed to write a glowing review every time).",5/9
3,8,22,4,Snowy161,25 January 2014,"There will be spoilers.The plot for this episode is supposed to be centered on a fund raiser organised by Angela's senator husband. While that might have been funny, unfortunately the episode doesn't have much to do with the fund raiser, or its cause - the actual focus of this episode is, yet again, Andy.So what's he been up to since he left Dunder Mifflin in the previous episode? Absolutely nothing interesting. And since his previous co- workers are so worried about him and his mental health, they decide to keep telling him he's awesome, that everything is OK and generally just pampering him. It's annoying. He's not a good character, he's annoying, just kick him off and forget about him.Andy's jokes felt forced and plain unfunny, especially when interacting with Robert California, his ""subtle"" jabs at Robert with his ""rock opera"" even get called out as lame by other characters - yet instead of stopping with that stuff, it remains in the episode and serves as one of the ""good things"" to focus on.The only characters who felt grounded and realistic were Robert and Kevin (which is very unusual since they've been making him into a retard for the past few seasons).Not to forget, the side-plot with Angela's senator gay husband is still going on and brings perhaps a few laughs when Oscar discusses the situation with Jim and Pam. Other than that this episode should be avoided. The episode or the things that happened won't be mentioned in the future so you won't miss out on anything important.",16/23
4,8,22,6,vivar-00811,20 May 2021,The writers made a bad version of Michael Scott (Andy) I don't know why they didn't make him complete the series.,1/3
0,8,24,NA,bob the moo,23 June 2012,"Once The Office US got its own voice it quickly became really enjoyable indeed; the first season was a mistaken attempt to simply repeat the UK original but the second season saw it hit its mark and become its own beast. Later seasons saw it become more of a regular sitcom but it retained enough of its comedic strengths to stay funny. The eighth season manages to keep some of the comedy and the overall approach of asides and smart dialogue but unfortunately it mostly does it within the frame of plots that don't live up to the standard we have come to expect.Ironically the problem with the majority of them is that the plots are often trying so hard to be classic Office that they end up repeating old plots and character arches whether they work or not. It doesn't start out this way though and indeed Robert California adds a wonderfully enjoyable new element to the show that maybe could have been used as a fresh core to the show. Unfortunately, although he is kept and remains good value, he is moved to one side to install Andy as the manager and essentially make him into a Michael Scott character. Once this is done we get a whirlwind tour through the previous seasons in regards repeating Scott's story through Andy; the winning over of staff, the being a jerk but yet also a decent guy, the dealing with corporate threats to the office, the challenges of a competing manager, branching out on his own, acting impulsively in the name of love, and so on. Not all of it is bad but for sure it is hard to escape that fact that the writers are not dealing well with the exit of Michael and have instead just decided to recreate him and try and keep going the way things were.It isn't just this core character though, there are lots of retreads – but sadly a lot of them are clumsy or exaggerated to try and generate energy to add freshness. There are many examples of this; Dwight and Angela again, Ryan and Kelly again are two straight repeats, but more telling is the attempts to repeat plot structures with new characters. So, I liked the ""wouldn't they be good together"" flirting of Darryl and the unavailable Val, but it still felt like a plot thread written because the show knows that office romances have been good material before – so they try to force this one rather than letting it happen. The nature of the supporting characters means there are plenty of options for asides and comedy and often the show is still very funny, but the side-characters are perhaps a bit too pushed to be bigger and noisier than before and not all of the material is as good for them as it was in the past.In terms of additions, Robert California works but Nellie Bertram simply does not. OK she is the exaggerated randomness that the show often loves, but with it she is unlikable, grating and tends to be annoying random rather than fun random. Tate is an acquired taste and I must confess it is not one I often seem to have – I have liked her in some things but here she simply doesn't work as a character or in terms of material, so her performance may be dedicated to delivery, but it is still a delivery of a weak product. The other cast members are better but often struggle with the material as well because, although they are doing good work, there is an air of them doing it with weaker material and when they have in the cast. There is also a sense that they are being asked to do more than their characters are suited to considering that this is a show that was best when the support cast were sparingly and well used.The eighth season of this show is still quite funny and it has enough energy to it to carry it through its problems – but there are problems. The loss of the central character offered the chance for freshness but instead everyone is moved to fill his gap whether they fit or not The material mostly feels recycled with new characters or repeated versions of what has gone before. The dialogue and the performances continue to be good but the overall writing and plotting is weaker and if the ninth season continues the direction of this season then it probably doesn't have too much life left in it.",21/32
1,8,24,9,ComedyFan2010,4 February 2019,"Andy gets his job back.A nice season finale. I am way too happy that Andy got his job back. Will miss Robert California, but having David Wallace back is great. And the ending with Dwight and Angela kissing in the waiting room for the test results and Senator telling Oscar to call were a great cliffhanger.",16/21
2,8,24,1,zkonedog,5 July 2019,"For five (arguably six) seasons, ""The Office"" combined humor with emotion to produce some of the greatest television ever seen over the airwaves. Then, a transition season (seeing the departure of Steve Carrell) left the show with a very unstable future. Sadly, the ""circle down the drain"" only continues with this eighth season, producing no redeeming moments whatsoever.This season was lost right from the get-go and never improved one iota. The additions of James Spader & Catherine Tate to the cast proved to add nothing to the ""Michael Scott void"", while all the other characters begin to really get stale for the first time in the show's now-lengthy run. Some of the ""lowlights"" of this season (minor spoilers ahead) include...-The complete ruination of the Andy Bernard character and his relationship with Erin. This was supposed to be the next ""Jim & Pam"" kind of relationship, but it has failed miserably. The ""Nard Dog"" was once the funniest character on the show. Now, he is just a shell of his former self. His character just isn't the ""leading man"" type.-The new additions to the cast also failed to impress and even further muddy the waters of the show's identity. But, what should have been expected after the failed experiment of the Will Ferrell character in the previous season?-The auxiliary characters are now old and stale. Whereas their eclectic comments once seemed to never get old, now they are almost cringe-worthy most of the time.The sad fact of the matter is that Michael Scott was the glue that held ""The Office"" together. With his departure, everything has completely melted down. I can honestly say that not a single episode of the entire season stood out as ""funny"". Only Rainn Wilson's Dwight Schrute remains even remotely entertaining (with Jim/Pam now completely played out).I fully expect the show to continue as it is such a big hit for NBC and the network will milk it dry and then some, but I made have to make the tough decision to jump ship before the resolution. I do not take this decision lightly, as I have invested so much in the Dunder Mifflin-ites, but it has now become a chore to watch each week. I saw the same thing happen with ""Smallville"" over on the WB/CW network, and it saddens me to realize ""The Office"", which was once so great, will go out with such a whimper.If you are a casual fan of this show and don't necessarily need to ""see the payoff"" in the end, I would actually encourage you to stop watching after the Michael Scott departure episode towards the end of season seven, which could have (and should have, in hindsight) served as the show finale. All that has come since has been pure dreck.",27/48
3,8,24,8,vivianla,26 February 2021,Dwight holds a free family portrait studio and everyone takes pictures with their kids. Pam brings their cute little ones and Dwight says cute kids. Dwight tries to get some kind of sample from Angela's baby. He takes the diaper and rushes to get it tested.Andy pretends to be in a bad state and begs for work. He knows that David Wallace is the new CEO and the company is no longer under Sabre.,0/2
4,8,24,8,Faristuta,15 June 2020,This season was a disappointment but it's still better than most things on TV/Netflix. The new characters added weren't very charming. Pam is not as likeable but maybe because her character matures compared to others like Erin and Kevin. Dwight seemed to carry the show in a few episodes besides good performances from others. It's clear that they're struggling to keep the show going after Michael left. Most opening segments were very funny though!,16/16
5,8,24,9,samratsingraur,3 November 2020,"This episode is actually quite good. It made me laugh at places where I least expected including the Dwight's plan for Baby proofing. Andy Bernard's character development is on point. The way he's been all over his ups and downs to finally the position that he deserves, is very pleasing to see.",1/2
6,8,24,6,Critic_For_Life,9 August 2020,Probably the worst cold open. Andy just getting so annoying. The season was much longer than necessary. Season 9 is better. Dwight does get better over time. Jim and Pam storyline a wee boring. The Senator and Angela not the worst. Robert California funny. Kelly and Ryan relationship worn out.,11/16
7,8,24,1,DragonFodder185,24 January 2021,"The worse character to ever show up on The Office is Nellie. She makes me ill and I never even chuckled in her lame attempts at jokes. They totally ruined Andy in this season, he's a slobbering pathetic blob now. Robert California is just disgusting, what a waste of good talent with James Spader. Terrible season overall... is this a prelude into season 9? I hope not.",5/11
8,8,24,4,BoredNow33,29 April 2020,"Some satisfaction after a whole lot of awful episodes. But it wasn't enough redemption to bring back my lost respect for the show. I had thought losing Michael would be the worst part of the show, but boy was I wrong. They got rid of one of the suck characters, but not the other. They both needed to go.",3/8
0,8,1,9,ComedyFan2010,25 January 2019,Robert California makes a list and everyone tries to figure out what it means.Great episode. Love how they got Robert California as CEO and made Andy a manager. Robert California is actually a very interesting character. Everything he says is just hilarious. And I loved the whole lists idea and how they reacted to it. Andy was sure a good manager to deal with it in the way he did.,17/27
1,8,1,8,vivianla,17 January 2021,Things have changed at Dunder Mifflin. Planking is the new hot trend. Jo has replaced herself with Mr. California. He appointed Andy as regional manager.Pam and Angela are both pregnant. Angela shows off the fact she is much smaller than Pam.Mr. California works in the conference room and has this interesting demeanour. He sounds intelligent yet strict and quiet.,2/6
2,8,1,8,pjgs200,28 June 2016,"""The List"" is easily one my favorite episodes of the Office. It's hilarious, witty, and heartwarming. James Spader is excellent as Robert California; and John Krasinski, Jenna Fischer, Ellie Kemper and Ed Helms are all lovable as ever in their respective roles. Andy, whom I didn't like much for a very long time, is starting to become a much better character, and Dwight's sequence with his weekly routine was really funny. The beginning of the episode with the planking was funny, and a great way to start the installment. Kevin was great, even with the minor role he was given. I loved when Phyllis fell out of her chair as well. There is nothing I can complain about in this episode. It was an awesome start to the season, and one of the best episodes ever",18/35
3,8,1,1,chas437,25 March 2019,"I realize there were plenty of talented comedians in supporting roles on The Office. But when Steve Carrell left in 2011, he took the soul of the series. It makes me appreciate what a comedic giant he truly was.Rain Wilson was great, clearly the next best after Carrell, but alas, he couldn't carry the series by himself.The James Spader experiment was an unmitigated disaster, and it was a ratings calamity as well. Spader was a fine actor, some 30 years ago. He has aged quite badly, and is not funny at all. Just as Carrell raised his fellow cast members to new heights in comedy, Spader makes them seem dull and uninspired.Every great show has an arc, and The Office's arc ended when Carrell left. The last 2 seasons are forgettable, and long forgotten.
Summary: Departure of Michael Scott Effectively ended the Series",30/65
4,8,1,10,hrayovac,5 August 2020,"I know that I'm in the minority for two reasons: 1. Spader's dry wit and delvery is hugely satirical to me, I found his arrogance hilarious and 2. I watched the entire series INCORRECTLY having been in quarantine, I caught the middle up to Robert California, then TV decided to air it from the beginning now I've seen every episode for the first time..newbie says, it's all good.",5/10
5,8,1,10,amillerz3,25 September 2011,"It's definitely different without Michael Scott, but I was pleasantly surprised and overwhelmed by how funny this show is. Andy was definitely the right choice for manager and James Spader is perfect as the new boss. Dwight is completely ridiculous and absolutely hilarious, especially with policing the planking. They put Jenna Fischer's pregnancy to use and made Pam pregnant again, which was clever by the producers, but also kinda weird. Also, Angela was pregnant with the Senator, and I died laughing when I found out they got married. Everyone else (Stanley, Phyllis, Oscar, Toby, Darryl, Ryan, Erin, Kelly, Creed, Jim, and anyone else I'm missing) all had their own moments to shine and the made this episode great.Based on this premiere, I am very excited for this year and hope the rest of the season is as funny as this episode.",18/40
6,8,1,3,tkk3107,12 October 2011,"As Michael Scott left Sabre my anticipation for the newer episodes fell, but as James Spader nailed the role as Robert California I became really excited to see the new season of the office.On Septemper 22nd all my hopes for the series was crushed. The new episodes are the worst ever made and I recommend you to pretend the series ended with season 7.The episode is dull with only few minutes of actual entertainment. The episode has an awkward atmosphere as Andy is given the job as regional manager, which in my opinion is a role, that he is not a big enough character to carry.",34/58
