,season,episode,Rating,Name,Date,Text,Useful
2,6,4,9,vivianla,5 January 2021,Pam asks the office to not have scents around her that could make her nauseous. Dwight explains she has pregnancy sickness. Dwight goes ahead and eats an egg anyways causing Pam to throw up. This causes Andy to throw up and then more people throw up. Dwight looks at his egg.The office drive to Niagara Falls. They meet the receptionist at the hotel and Andy has booked the honeymoon suite the day before Pam and Jim will get it. Pam and Jim will sleep in separate rooms before the wedding.Pam's sister is blonde and gorgeousDuring dinner Jim accidentally reveals that Pam cannot drink for obvious reasons. Meemaw asks why. Jim admits she is pregnant and Michael tries to smoothen it out in his way but makes it way worse. He describes intercourse and says they were living together so it is hard to not use protection. With or without protection and certain moves feel different for guys but not really for girls. This shocks Meemaw.Meemaw no longer plans on attending the wedding.Andy has a dance party in his room. He does the splits but lands on his keys. He is brought to Pam's room and he tells her she needs to drive him to the hospital.,1/2
3,6,4,10,theteamavengers,7 June 2020,These two parts were beautiful. I had tears of joy watching the wedding.,2/5
4,6,4,9,maine_310,22 October 2009,"Finally it's the big one 'Jim and Pam's Wedding' and everyone from the office is invited. I am sure Jim and Pam could have easily told them a different venue and have their wedding elsewhere with only their family and true friends, dumping the drama down the drain. As much as Jim and Pam may resent working with some real downers, their wedding would not be the same without them. That and they would have creepy phone calls and unending chatter if they stood everyone up.The one thing I loved about this two part episode is that we got to see both sides of the family relating to Jim and Pam. We had some re-occurrences and new faces, but out of all Pam's Grandmother took the cake. I knew someone would have revealed Pam's pregnancy and all eyes would have been on Michael, but the way Jim delivered it '...because of obvious reasons' was essential and in a way unexpected from him.I can tell you for sure that I didn't really peg Dwight to be the stud muffin the writers portrayed him as nor did I ever believe a member of Pam's family would fall head over heals for him. That was an odd twist to the show when Dwight sent Pam's sister away like a one night stand put away like last weeks garbage. I actually felt sorry for her, especially since her taste in men lacked the necessary thrill of the moment. It would have been fun to see Angela and Dwight use the moment to rekindle or deal with whatever flame they once had together. The whole Dwight-Andy-Angela triangle is still unresolved.I honestly commend Jim and Pam for redeeming their marriage at the last moment, every girls dream is to have their wedding at Niagra Falls on the Maid of the Mist...well at least it was for Jim and Pam when they tied the knot, it was one of the most beautiful scenes. I saw the expressions on their faces when everyone decided to make a mockery of their wedding-somewhat- it was like 'You can do whatever you want to this wedding, because my dream wedding just passed a few hours ago. At least the engagement is over.Lexa Reviews http://lexabuti.blogspot.com______________________Four and a Half StarsGrade B+______________________",13/21
5,6,4,10,Pruikhoofd,30 January 2022,"Part 1: The first part is really funny and contains some great scenes, for example: Michael finding out he doesn't have a hotel room and Dwight tricking him was quite funny. Another scene from this part where Jim accidentally tells that Pam is pregnant was also really funny.Part 2: this is the best part of the two, with the famous dance scene at the church to the Chris Brown song. Also the ending with Kevin sticking his sweaty feet into the ice machine was a typical office joke which was a good ending of this episode.Overall 10/10.",0/0
6,6,4,10,rahenson1,15 November 2010,"Be warned. I will spoil if you haven't seen the episode. Five years and over 100 episodes for this moment. And it delivers big time. Slightly drunk Jim telling Pam they should talk forever. Andy's injury. Dwight's wolf shirt. Kevin's destroyed shoes. The scene with him and the ice machine. Michael's painting and the other painting he doesn't show us.But as great as the laughs were this episode never could be fully or even mostly about that. Hidden in the insanity of this office is a real love story. It has always been there. We know it's more than just about everyone can hope for in real life. But some of us do get to live it. The rehearsal dinner speech. Jim cutting his tie for Pam. Everything on the boat going right this time.His last line gives romantics everywhere a reason to keep it alive. ""I knew as soon as I saw that video we'd need a backup plan. The boat was actually plan C. The church was plan B. And plan A was marrying her a long, long time ago. Pretty much the day I met her."" I hope everyone everywhere finds the person that lets them say this same thing. It will be worth whatever the cost.",25/28
7,6,4,10,jtw929,10 October 2009,"I was very excited for this episode of the office. Its the one that many of the fans have been waiting for, Jim and Pams wedding. The first 3/4 of the episode if pretty much good old goofy Office style. Michael and Dwights funny antics, laugh out load jokes, and Andy's unfortunate injury. Only it was the last quarter of the episode that stood out from any other Office episode ever. From the dancing in the aisle by the Office employees to the amazing shots of Jim and Pam on the Maid Of The Mist. They all tied in well and made this possibly one of the most unforgettable moments in the shows history. I really felt that the crew members hit the target with this and made it memorable, especially for the true fans. Then to cap it off, Michael hooks up with a certain someone's mother which should make the rest of this season great!",47/52
8,6,4,10,namedujour,12 October 2009,"What a perfect wedding! And a perfect episode. (I had it on TIVO and watched it twice) I loved the fact that they gave Pam and Jim a really romantic wedding (the one you wanted for them) performed by a ship's captain under the Falls, in addition to the big farce with the families (the wedding you personally wanted to see). I loved the viral Youtube dance, and wondered how the original couple who did it felt, watching. The Office had the rare opportunity to pull it off while everyone still remembered the original video, and before the whole thing got to be a tiresome cliché. Bravo.Does anyone else besides myself think they're setting up Michael Scott and Pam's mom? Speaking of that, I seem to remember someone other than Linda Purl playing Pam's mom in past episodes. Does anyone know if they switched actresses? Also, wasn't Stanley's wife white? Did I miss the story line where he divorced the white wife and married a black one?",28/32
9,6,4,10,eastdane-01260,14 April 2017,"I really loved this episode. Jim and Pam have been my favorite characters since the Office started, so seeing them get married was just amazing. This episode was so much fun to watch, the cinematography was beautiful and the acting was superb.10/10 I love the Office",6/9
10,6,4,10,alfinandri,17 June 2020,Main phase of Jim/Pam relationship. Amazing Jim speech.,0/3
11,6,4,10,ilijakovacev,8 December 2020,"Literally the warmest thing I've ever watched, sums up every beautiful piece of life this hilarious show has to offer.",4/5
12,6,4,10,mohanjgopal,6 January 2021,Chris brown song killed it when they were dancing .the beautiful thing ever seen.this gonna be onmy wedding playlist for sure in future,1/4
13,6,4,10,ajdfauhiulallallala,8 March 2017,"This is such a beautiful episode. Jim and Pam are what make the Office the best, and this is their best episode. It's funny, heartwarming, emotional, and everything you love about the Office in one episode. I love the direction, the acting is flawless, and the script is great too. I love this show and everything about it. Almost every other episode is an 8, 9 or 10/10 too. It's too bad that people are coming on here and rating every episode a 1/10 and leaving negative reviews just because they don't think something is awesome, but rate it 1 star just to bring the rating down.",5/7
0,6,6,8,ComedyFan2010,15 January 2019,An insurance salesman comes by and Dwight thinks it is mafia.Now that Jim and Pam are on honeymoon there is nobody to stop the crazy. Oscar alone isn't enough. The whole mafia paranoia was great. I loved all three of them dealing with it. Andy dressed up as a mechanic was wonderful. And how they told Michael that it wasn't mafia and then told him it was so they all thought he defeated mafia. Priceless.,19/21
1,6,6,8,Edvis-1997,13 November 2021,"I wouldn't agree with this 7.6 IMDB. I'm convinced that this deserves at least 8/10. It had creative idea, plot wasn't hard too fallow and it finished with cringe. Just delightful.",2/2
2,6,6,8,vivianla,5 January 2021,"A Southern Italian insurance agent comes in and Andy and Dwight immediately assume he might be in the mafia. His name is Angelo Grotti and is tough. He tells the waitress his order and that he will send it back if it is not what he wants.Kevin uses Jim's office and picks up a call. Kevin accidentally cancels Jim's credit card. Another hilarious scene is when asking Oscar about it and Oscar said this is identity fraud, Kevin says he cannot last in jail like Oscar can. Oscar asks what does that mean?",0/1
3,6,6,7,maine_310,22 October 2009,"It wasn't really established whether or not the insurance agent was  'mafia' or not. He actually seemed like an insurance agent, because  when it comes to Dwight, Michael and Andy, they usually can blow a  simple solution out of proportion.  The one thing we as people learn over the years is that you don't mess  with a newlywed couple on their honeymoon, no matter how dire the  situation is. I am sure Jim and Pam were well aware that Michael would  find a way to interrupt their time away, I think Jim dealt with it the  best. Usually when you are trying to cut someone off you pretend as  though you are breaking up. A little harsh, but calling someone to talk  about the mafia while you are on your honeymoon, I would just hang up.  Knowing Michael would probably keep calling for sport, so it's always  best to just keep the conversation short and stop it from ever  happening again.  I couldn't believe it when Oscar called Jim, I didn't know he relied on  him for office advice so profoundly. So when Michael actually got  intimidated into signing the insurance policy and then backing out when  he believed he wasn't Mafia, I kept wondering why he didn't fear for  his life upon the surface of Dwight and Andy's lie. It's funny how low  they perceive Michael. I probably know what Michael thinks of both Andy  and Dwight. Jim, next time do not leave your social security lying  around, the person that steals your identity could very well be your  best friend, or at least someone you know.  Now that the honeymoon is over, what's up for the Newly Weds and gosh  how would their baby fit into the office lifestyle?   Three and A Half Stars  Grade B-",11/24
4,6,6,10,nbrice18,20 September 2021,"I'm watching from the beginning for the first time, and Mafia is the only episode that made me literally laugh out loud. I was laughing so hard that I had tears in my eyes, and I'm still laughing today.I'm a fan of the Sopranos and other Mafia shows, Mafia movies, and Mafia books so I instantly said to my husband that Mr Grotii looked and sounded like he was in the mob. Dwight and Andy were so funny as straight men and as another reviewer said, Michael is funny when he's not trying to be.The scene in the restaurant was the icing on the cake and every time I think about Michael ordering ""gabbagool"" (the way Tony Soprano pronounced capicola) I crack up.Kevin and Oscar were great too. Outstanding episode!",2/4
5,6,6,7,Faristuta,17 September 2018,The main story about the Mafia was very silly. What made this one stand out was the minor characters especially Kevin- strong jokes there.,3/13
6,6,6,2,drewstewartcola,18 October 2018,"We're used to the whole paranoid, Dwight thing, but this just isn't funny, it was clear from the start even with Mike Grotti in his typical stereotypical Italian Thug fashion, it wasn't funny at all. It was just boring.",10/38
7,6,6,1,jjblue202067,23 March 2020,"Did a 9 year old write this episode?! it's like watching a different show, what hell were they thinking when they wrote this",9/42
8,6,6,7,annamp-89146,1 April 2021,"I actually enjoyed the show. The only time Steve is funny is when he
is not trying to be funny. This story line suited him.",2/4
9,6,6,7,c0ngratulati0ns,20 October 2020,"I hate saying it as it's always annoying when people say it, but this episode is in short underrated. Sure it feels more PG then it should and has a pretty dumb plot but that doesn't stop it from being a all around funny episode. The plots that Michael thinks he's being chased by the mob, and because Pam and Jim are gone Kevin took Jim's desk. The conversations with Pam and Jim on the phone are overall funny, and Michael has some great scenes as well especially when he confronts the mob right to his face and builds traits off of him.",8/10
10,6,6,1,jakoulecroustillant,3 March 2021,"From season 6 the show is falling apart, this episode is one of the dummiest content ever, who would believe that story to be true, seriously...",2/7
11,6,6,10,bastiaanzijlstra,10 January 2022,"Not sure what's wrong with me (compared to other opinions about this episode), but I just totally loved this one. Tears in my eyes from laughter on Kevin in his private office, and Andy, Dwight and Michael and the mobster. The fact that I believe he is a mobster, doesn't say anything.",0/1
12,6,6,1,monixeded,19 March 2019,"I'm a bag fan of the office, have watched it over atleast 5+ timesLet me just start by saying this is the monkey wrench in the 6th season, every episode wether irrelevant or direct to the narrative has some underlying dictation to the outlying plot, it's like the writers hit brain freeze without Jim & PamThis plot maybe would of worked in season 2, when characters where still building their portfolios but this is such a big miss, like seriously Dwight thinking the mob is shaking down Dunder Mifflin and him being a former ""Volunteer Sheriff"" taking that it contradicts his character values absolutelyI could go on but I love this show, and should someone read this review that hasn't watched the show, I wouldn't want to defer their judgement from an anomaly review, that being said this episode is the only sub-par one in all of 6, I really can't fault the writers their after but seriously people that review plots really should of reviewed this over",11/53
0,6,8,8,ComedyFan2010,15 January 2019,"Michael falls into a koi pond at a meeting.A pretty good episode, Michael coming in all soaked up and wearing Jim's suit that is too big for him is cute. The jokes everyone came up with for him were also good and I loved the meeting. Dwight's nose is small! The video showing how Jim lets him fall in is a good twist. Although whenever I watch it I am thinking that most people step away in such cases as an instinct to not being pulled after",5/9
1,6,8,7,Edvis-1997,13 November 2021,Am I the one who was interested in talking with clients who asked for Michael to be part of conversation? And it twisted it in something about Koi Pond? Disappointed.,0/3
2,6,8,8,vivianla,5 January 2021,Jim is asked by the client to go with Michael for their meeting. The client stated he would feel more comfortable if Michael was also there.Michael fell into the koi pond in the lobby. He becomes there butt of the jokes in the office and Jim suggests he laughs at himself. He goes a bit too far by mentioning that in high school he was thrown into the lake by volleyball girls.Pam and Andy are paired together as they have the lowest sales. Clients assume they are a couple and finally they go with it and pretend they are. In the car Andy says roleplaying is fun for him - imagining he has a wife and baby. He hates being single and is interested in Erin.Erin is very careful and asks Pam to flip the paper so she won't accidentally see the contents.,1/2
0,6,10,9,ComedyFan2010,15 January 2019,"There is a reason to worry in the office and Michael keeps everyone distracted with a game.The accents were pretty funny, especially Oscar. Michael making this game was also pretty sweet, as he said this was the hardest he has ever worked. The dating thing between Andy and Erin was also a good part of the episode. And loved the ending with Pam also being part of it.",49/52
1,6,10,7,Edvis-1997,13 November 2021,"This whole episode was just bad for me. I get what Michael was trying to do, just forget or we can even say run from problems as he usally does. But it wasn't vibing for me.",1/6
2,6,10,9,vivianla,6 January 2021,The office is worried about the state of the company and that they may lose their jobs. Kelly says what if they never see each other again.Michael takes out a game and gets everyone to play in the conference room. We see everyone's acting skills in this episode.,3/6
3,6,10,2,gordonjackson-58694,17 December 2020,Wtf is this utter pile of rubbish. Worst episode of a sitcom I've seen in a long time. Michael finally finally is the worst character in any sitcom. Unlikeable. Stupid. Stubborn. Unfunny. Unfunny.,3/75
4,6,10,1,annamp-89146,1 April 2021,"My husband and I watched this show thinking it had a low rating.We were shocked. Everytime I watch The Office, I wonder if Tim Allen
from Last Man Standing, could do a better job than Steve Carell.Oh yeah!!!! We thought this show was sooooo annoying!!!!!Thank god for the Jim character on the show!!!!!!!",0/52
5,6,10,10,hajosar,17 November 2021,"""Murder"" has a great arc that sets the dynamic between the co-managers in a time of crisis and shapes the way they communicate with the others.The density of jokes is really high, and as cherry on top: the awkward phone call with David's assistant is one of the better ""Michael phone calls"" this season.",2/2
6,6,10,10,saneaia,24 February 2021,One of the best episodes of the office (period)I DO DECLARE,17/20
7,6,10,7,moirachrist,2 May 2018,"As a southerner, this is painful to listen to. What in the world!",7/147
0,6,12,8,ComedyFan2010,15 January 2019,Michael needs to talk to high school kids whom he promised college tuition 10 years ago.Ah yes this story makes one cringe a lot! I feel so bad for Michael! Should probably feel bad for the kids but Michael makes me sadder. I love though how he sings the Mr. Scott song at the end.The Employee of the Month story was funner. Looking forward to more of Dwight's diabolical plan.,20/26
1,6,12,8,DKosty123,22 April 2010,"I happened to see this episode on an airline flight. It is a pretty good episode. Just imagine the young ambitious executive wanting to do something he could be proud on, banking on his future success, visiting a third grade class & promising them 10 years hence free college. That is what Michael did. It even gets published in the newspaper.Now it is 10 years later. Michael hasn't made the millions he thought he would. The class remembers his promise & calls him back too meet the high school Seniors counting on him to send them to college. Top that off with college costs doubling the last 9 years. What to do? Michael is the guest of honor at an Assembly where he is lavished with presentations by the class. Then, after being brought too tears by some of the kids he promised to help, he has to get up & tell them he is a little short. I thought this was done very well.In a sub-plot, back at the office, there is a new Employee of the Month program which gets off to a rocky start when some extra unplanned twists are put in - like an obscure rating system that appears to be rigged- & one of the employees going around collecting cash into a pool for the winner which was not intended. Then everyone except the winner seem to be unhappy with the winner.I have not seen a lot of episodes of The Office but I found this one to be pretty good & creative as well as funny.",33/45
2,6,12,9,Edvis-1997,13 November 2021,"This episode and what Michael did in here was so cringe and awkward that I had to skip couple times before he revealed the truth. Omg, I was laughing so hard.",1/4
3,6,12,8,vivianla,7 January 2021,Dwight has a diabolical plan to take Jim down. He agrees Andy thought of the idea and Jim does not suspect anything. They start the employee of the month idea and Dwight collects twenty dollars from everyone. The person with the highest performance however was Jim and this causes an uproar. The next highest is Pam Halpert. David calls Jim and is angry but then calms down and asks if they are still going for dinner.Michael promised tuition ten years ago to fifteen black kids. In the car ride back Michael talks more intelligently and says Kevin was first applying for a warehouse job. Michael had a good feeling about him. He tells Erin he has a good feeling about her too.,1/3
4,6,12,8,minutolo,21 January 2021,"I've seen many fans say that this is the most uncomfortable episode and while I totally agree, it should be known that the over-the-top awkwardness adds to comedy and overall performance. The 'employee of the month' subplot is okay.",17/19
5,6,12,1,jaigurudavid,14 March 2020,"I've never understood the logic of this episode. Somehow, Michael Scott has done a great thing by giving away money. Somehow, that motivated kids to stay in school, instead of dropping out and getting into drugs. That makes no sense. You can't help people just by giving them something. You have to give them something to work towards. A goal. Not just a hand out.",6/220
6,6,12,9,noahgiovanniprz,9 July 2021,"It is hard to watch, but is finally very good. The b-plot is also mildly interesting. Not as bad as they say, but surely hurts to see the pain Michael's eyes.",2/4
7,6,12,9,tylernjazz,30 July 2020,"Despite it may being hard to watch, this episode is well written, has character development, and is funny. Don't take out your anger with Michael on the rating. No one rates Breaking Bad a 1 because Walter White is a bad person.",91/95
8,6,12,NA,sabian-36199,15 January 2020,"1-10?? Skip the Episode?? Wow.
The internet hoards a crapload of dummies.
Michael Scott's long lost, 3rd cousin-twice removed would call you slow.
Look up cringeworthy. This one, is among mostly the ENTIRE series ranks there.
Someone needs to take you off of
..anything.",14/47
9,6,12,1,bigeddogg47,21 July 2020,You can skip this episode completely and it will have no impact to the rest of the series it's a complete waste of time.,8/100
10,6,12,1,Scott-12,13 September 2019,"This is one of two episodes that show Michael as an absolutely despicable human. The other is Prince Paper. And it's unnecessary. He is always cringey. Frequently a jerk. But when it gets down to it, that is always because he thinks he is being funny. But these two episodes are different. They show him taking irreversible actions that hurt real people. In Prince Paper, you can watch the opening scene with a Jim/Dwight prank, then skip the rest. In Scott's Tots, there is nothing worth watching. Even the bits back at the office with the rest of the characters is boring and unfunny. Just skip the whole episode.",24/216
11,6,12,10,aliilhangs,16 February 2021,This episode defines the standard for 'cringe' episodes. It is hilarious my god hats off to those who watched on a single attempt,40/42
12,6,12,4,dferg-00133,20 April 2021,I love the show but in this episode I absolutely hate how those black kids and teachers were portrayed. The only reason they thought that they had a chance to go to college was Michael Scott??? They were dancing and cheering for him like he was their only hope. Then the last kid comes out begging for a handout. As a black man I hated that whole premise.,6/31
13,6,12,10,deavoninja-56341,15 June 2021,"I'm not sure any other singular episode does a better job of showing Michael's true character. He is a well-meaning, optimistic person, but to such an extent that he ends up going way too far, often unintentionally but predictably hurting people in the process. The cringe factor is off the charts for a sitcom, it's one of those episodes that will have you squirming, covering your eyes, or even skipping it entirely.",7/8
14,6,12,10,connorjamin,16 April 2021,"Although this episode is hard to watch for other people, i just thought it was funny. I was basically like stanely at the begging of the episode throughout the entire thing. If you can deal with awkwardness i highly recommend it!",7/9
15,6,12,10,alangreenleaf,9 July 2021,"Hey Mr. Scott, what you gonna do? What you gonna do? Make our dreams come true!",6/8
16,6,12,NA,loyd-arthur,22 June 2019,"... That I will never watch!I would pay double for Netflix if I could remove this 'sode n the queue.The only time I see it is while I am sleeping.If you enjoy feeling uncomfortable, this episode is for you!Solid 10/10",24/47
17,6,12,NA,jakedchoi,27 January 2019,It has to be one of the most painful episodes in the series. Both main plots are so painful...,80/100
0,6,14,5,ComedyFan2010,18 January 2019,A banker comes by to evaluate Dunder Mifflin for a buyer.A usual filler episode. I hate those. Sure the moments they chose in the flashbacks are funny. But we saw them. And we don't need them like they did in the 90's. Now if we want to see best moments of the Office we can go on Youtube and find even better selections.,30/55
