,season,episode,Rating,Name,Date,Text,Useful
0,1,2,9,ComedyFan2010,27 December 2018,"Hilarious episode. After Michael tells some offensive jokes they company has to go through diversity training. But Michael prefers to do it his own way.This episode has plenty of great jokes. Michael trying to run Mr. Brown's diversity training had many great moments. It became even better when Michael makes his own diversity training and makes them insult each other with stereotypes of the race they got assigned. It is also funny how he says that ""it is too soon for Arabs"".",7/9
1,1,2,5,studioAT,17 October 2021,This episode just about manages to combine the toe curling comedy that made the UK version so popular with some nice heartfelt moments in this second outing of the show.I enjoyed it.,1/7
2,1,2,8,Edvis-1997,24 October 2021,"Well, that was so relatable even in Nowadays, lmao. Great episode, so far 2 out of 2 worth watching episode, didn't disappoint me yet and I hope it won't disappoint me in the future.",3/4
3,1,2,9,MaxBorg89,11 February 2009,"After following the British template almost slavishly in the pilot episode, the American version of The Office goes its own way already in the second show, the painfully hilarious Diversity Day (although, truth be told, it does occasionally remind of the first episode of the original's second season).Shockingly, the fun derives from Michael trying to fix something: after one of his employees told a subtly racist joke, a Diversity Day is organized. What Michael doesn't know is that the spokesperson in charge of the event, Mr. Brown (Larry Wilmore), is actually there because of numerous complaints about his behavior, not someone else's. That the boss thinks Mr . Brown is a made-up name - due to the person's skin color - isn't very helpful, either. Soon everyone in the office is involved in a series of increasingly ridiculous tolerance games that undermine everything Diversity Day is meant to stand for.From Michael's lame attempt at (mis)quoting Abraham Lincoln to Dwight's twisted mentality (when given a clue to find out what race he is representing as part of a test, he says: ""Aw man, what am I, a woman?""), this episode is a good example of the show's ability to pull off the same kind of awkward humor as the original version whilst adapting it to the American way of life. It's considerably lighter (the British one's gag about over-sized genitalia would never have made it past the idea stage), but that doesn't mean it's any less entertaining.",37/41
4,1,2,7,zhyarTheChosen,23 February 2020,People actually love this one over the first episode for nah,1/21
5,1,2,8,GunnersMate,30 June 2018,"Watching Diversity Day thirteen years after its debut is an interesting peek into office race relations and how much things have (and have not changed) in the interim. When the boss quotes (verbatim and with what he considers to be the perfect ""accent"") a racially-charged comedy routine, a Diversity Trainer is sent to the office to help deal with any fallout. Of course, the result is a rolling snowball of worse and more racially insulting than ever. Every nuance of racial political correctness is pounded into comedic submission. It is uncomfortable, it is funny, and if the episode were released as ""new"" in today's politically intolerant environment it would be lambasted as intolerant. But it is painfully true, and that's what makes it so very funny.",33/41
6,1,2,8,JosephPezzuto,2 June 2015,"So says the ""World's Best Boss"" borrowing a quote from Abraham Lincoln. An adaptation of the BBC series of the same name created in 2001 by Ricky Gervais and Stephen Merchant, The Office was adapted for American audiences by Greg Daniels, veteran writer for SNL, King of the Hill and The Simpsons. Both sitcom and mockumentary, first airing on NBC on March 24, 2005 from May 16, 2013, the series depicts the everyday life of office employees in the Scranton, Pennsylvania branch of the fictional Dunder Mifflin Paper Company. To simulate the look of an actual documentary, the show is filmed in a single-camera setup without a studio or a laugh track; our main characters sporadically posing as talking heads are either explaining or venting their emotions depending on however they happen to be feeling at that certain time to an unseen camera operator during a particular moment in the episode, often evoking hilarity. But when mixing in race? ""Diversity Day""! The second episode of the first season, the second episode overall, was written by Ken Kwapis (who also directed) and B. J. Novak who, for his work on this episode, was nominated for a Writers Guild of America Award for Best Screenplay – Episodic Comedy. When the egotistical but shallow central character Michael Scott (Steve Carell, loosely based on David Brent from the original British version) makes a controversial imitation of a Chris Rock routine, he forces the staff to undergo a racial seminar. A sensitivity trainer arrives (guest starring Office consulting producer and writer Larry Wilmore as Mr. Brown) to give the staff in the office a practical presentation about tolerance and diversity. Michael, however insists on imparting his own knowledge, aggravating both the consultant and the entire office staff in creating his own diversity seminar instead. Michael is seen later on signing the release for Mr. Brown passed around, with the name ""Daffy Duck"". Mr. Brown does not realize that the signature is bogus. Michael quickly fashions his more ambitious and improvisational program under the name ""Diversity Tomorrow"" (because today is almost over""). First asking the employees to detail their particular nationalities, he helpfully offers that he is a ""virtual United Nations"" of English, Scottish, Irish, German and ""2/15 Native American"" origins, thus assigning each office member an index card with a different race written on it. They are to guess what race they are based on by the actions and phrases recited to them by their co-workers but are not allowed to read it, wearing and displaying it on their foreheads for only others to see. Compelling the employees to interact and ""mix up the melting pot"" causes tempers to slowly simmer. Many uncomfortable but hilarious exchanges of various stereotypes occur between them, as Michael reasons that they will learn how it is to ""be a minority"" while ironically bringing up offensive stereotypes himself (Scott has no card for ""Arab"" or ""Muslim"", because, he explains, it would be ""too explosive""). This continues on until the staff finally snap under toleration for such petty inaneness. Meanwhile, Dunder Mifflin representative and love interest of the shy Pam Beesley (Jenna Fischer) Jim ""Big Tuna"" or just ""Tuna"" Harper (John Krasinski) struggles to keep hold of a lucrative contract extension that makes up about twenty-five percent of his annual commission. Amidst the entropy of the day, Dwight Kurt Schrute III (Rainn Wilson, based on Gareth Keenan from the original UK version), the successful paper salesman lacking in social skills, common sense and of whom is pretty much a fascist nerd, closes the sale for himself. Despite his initial personal dislike of Jim, the two are a very effective sales team nonetheless. Jim gets one of life's little victories when Pam falls asleep on his shoulder at the end of a meeting, as he concludes that is was ""not a bad day"". Premiering on NBC on April 5, 2005, it lost half of its viewing audience due to the previous episode, being the pilot, which had garnered over eleven million viewers to this episode's six. On the flipside, ""Diversity Day"", along with the other first season episodes of The Office helped NBC score its highest-rated Tuesday night slot since February 1, 2005. Entertainment Weekly gave the episode positive reviews, stating that: ""Think of the toss-off racism of the original, plopped into a PC-gone-wrong showcase that might be entitled The Accidental Bigot. As when the African-American diversity trainer introduces himself as Mr. Brown, and Scott assures him, 'I will not call you that.'"" Ricky Gervais stated: ""It is as good. I love the fact that, apart from the first one, the scripts are all original. You've gone back to the blueprint of what the characters are and you've started from there, as opposed to copying anything."" Rolling Stone magazine named the scene wherein Michael shows the office his diversity video the third greatest moment from The Office. However, Erik Adams of The A.V. Club awarded the episode a ""B+"", noting that the episode ""would go on to be one of the series' defining episodes, an installment that put a more hopeful spin on the original Office‍'s views on accepting the disparity between our dreams and our realities."" Two scenes that were cut involved Michael Scott responding to Mr. Brown's ""HERO"" acronym by creating one that sounded good until everyone noticed the words created the acronym of ""INCEST"", while another had Jim replacing Dwight's ""Asian"" headband with ""Dwight"" and then having the other co-workers complain to his clueless character about how annoying his behavior was. The pilot after the pilot, ""Diversity Day"" defined NBC'S The Office for cast and crew alike. Kwapis reflects: ""Well, it certainly took a while to find its audience. But creatively the show hit a home run in episode two. I mean, that episode really is a standout. Two hundred episodes later, that's really a standout.""",6/10
7,1,2,8,jonniedylanoliver,18 May 2020,"The first great episode of the show. It has good dialogue from our main characters and most of Season 1's minor characters. It builds on our perspective of Michael, and starts the shows main arc: the love of Jim and Pam. But compared to the funniest episode of the season for 2, 3 and 4, it doesn't stand a chance.",6/7
8,1,2,9,hreed-89565,28 November 2019,"Diversity Day is one of the best episodes of The Office and is my favorite episode of Season 1. The writers quickly found the right tone of the show and began writing brilliant episodes starting with this one. Michael seems much more like-able here, and the other characters all got their moment to shine when Michael held his own diversity seminar. Diversity Day is the first great episode of a great show!",12/15
9,1,2,1,geomisc,27 November 2021,"""Diversity Day"" is a pretty self-explanatory title. Those viewers who are easily offended will be relieved that the Comedy Channel skipped this episode today (11/27/21). Others can watch it on NBC's peacock channel. All in all, another example of where we are in the USA. We'll all see if this is comedy du jour or has legs.Personally, I am not a fan of suppressing creative expression. Is there really anyone out there who'll lose sleep after viewing this episode? Will anyone be scarred? My guess is some ""expert"" will argue just that. Comedy Central clearly has drawn a line in the sand. So, there's that.",1/8
10,1,2,NA,dsand95510,26 March 2021,"The network that shows South Park apparently doesn't have the stomach to show ""Diversity Day."" The shows are generally shown in order, and CC has skipped this episode for the past year.",11/14
0,1,4,9,ComedyFan2010,27 December 2018,"Dwight decides to form an alliance with Jim because of downsizing. Michael wants to make the office happy by throwing a month early surprise birthday party for Meredith.Wonderful episode. The whole alliance thing was a wonderful idea. Jim and Dwight together are hilarious. The whole thing of Dwight in the box was pretty good. I wish Roy didn't walk in on Jim and Pam, I would want to see Dwight spy as well. But he did dye his hair!The birthday story was also good. Poor Meredith! All the jokes that Michael did for her were just mean, and he thinks he is just a comedy king. But this is what made it for us funny to watch",3/6
1,1,4,8,Edvis-1997,24 October 2021,"It was very cringe episode to watch which makes it interesting but I want a little bit more dark humour or just jokes, so far, The office didn't disappoint me.",1/2
2,1,4,9,MaxBorg89,19 September 2009,"The US version of The Office continues to distance itself from the brilliant UK original by having more openly exaggerated sit-com scenarios (it is an NBC show, after all) with what is arguably the funniest episode of the short inaugural season: The Alliance, which shows another side of the endlessly hilarious Jim/Dwight conflict.With the downsizing rumors still in the air, Dwight suggests that he and Jim form a secret alliance so that neither of them will have any problems. Of course, Dwight reveals his trust issues to the camera crew, and boy, are they justified: the moment the ""alliance"" kicks off, Jim starts planning various schemes at his co-worker's expense. Meanwhile, Michael keeps coming up with ways to distract his staff from the gossip-induced paranoia.Like the previous episode, The Alliance is 20 minutes of comedy gold, based primarily on the spot-on interactions between John Krasinski and the superb Rainn Wilson, who almost do an even better job than Martin Freeman and McKenzie Crook in the British prototype. The ""best gag"" award, however, has to go to Steve Carell for when he explains why he shouldn't tell his staff about the downsizing: ""As a doctor, you wouldn't tell a patient they had cancer."" A masterpiece",10/13
3,1,4,8,zhyarTheChosen,24 February 2020,Really love this series I am watching it almost every day,0/3
4,1,4,6,gizmomogwai,8 December 2009,"This episode, The Alliance, is part of the US Office's first season- six episodes that don't get much love. Although I liked some of these episodes (like Diversity Day), I can understand a lack of enthusiasm for this one.Given fear of downsizing, Michael decides to lighten up the office by throwing a birthday party- despite the fact that the next birthday is a month away. Meanwhile, Dwight deals with the downsizing by suggesting an ""alliance"" with Jim.Much of the episode is kind of dull, there's little to laugh at besides Dwight's water bottle. Michael makes a reference to Donald Trump, but it's hard to see why I should care and if anyone else will in twenty years. He also makes a Star Trek reference that isn't very funny. Nevertheless, I can appreciate how imperfect a month-early birthday party is, and Pam's question as to what the ""alliance"" really means is a valid one.Towards the end, the episode does provide some laughs. The birthday girl's reaction, including to a cake she can't eat for medical reasons, is good. The downsizing joke is awkward. The fact that it's the temp's actual birthday is a humorous twist. The charity subplot also has a nice twist when Michael learns he's donated a lot more than he thought. It's not the greatest TV episode, but it does indicate the show has potential.",9/17
5,1,4,7,jonniedylanoliver,18 May 2020,"2 brilliant plots: Michaels Party-planning and Jim and Dwights Alliance. We start to see more of the office's opinion of Michael and the start of Jim's major pranks on Dwight. Also we see the struggles with Jim's love for Pam. Enjoyable, but not particularly memorable.",1/4
6,1,4,6,sudarshan-52058,2 June 2021,Jim pranking dwight is not even funny. It's funny for jim and pam but not us audience.,0/2
0,1,6,NA,bob the moo,26 March 2009,"A small branch of a stationary company in Pennsylvania is facing possible closure and redundancies and the staff aren't given a great deal of hope by having a bluffing clown of a boss in Michael Scott  a man who wants to be popular more than a boss. As office politics play a part, the staff try to deal with this hanging over their heads as well as the usual ongoing petty nonsense that is part of any office life.Adapting what is really a very British sitcom to be suitable for American tastes was never going to be easy and the first season of this show (which has grown in popularity) shows the problems right away. Season 1 is, for the most part, a straight reproduction of the original in terms of some of the stories but also very much the painful awkward feel of the whole thing. What this achieves is a quite funny sitcom because the material is pretty good but it falls down quite badly when it comes to the more painful part of the material  which in the UK original was essentially the show. We all remember the original as hilarious but the truth is that much of it was funny while being unbearably awkward. This worked so well because the characters so totally sold it as real and you felt them dying inside as well as seeing them act awkward at that moment.Here we have the conflicting aims of comedy and pain and the two don't sit well together. I got the sense that the US makers felt they wanted to do the UK version but that at the same time had a different vision for the show based on the US audience and also the different structure of the show (after all, the UK one was about 12 episodes total  not quite what the US networks expect from their shows). Perhaps it is better if you have never seen the original but the conflict can be seen in many areas but most noticeably in two key characters - Brent/Scott and Jim/Tim. Scott is very much a comedian who tries too hard and frequently falls flat, looking trapped by his own attempts at being ""cool. Brent was similar but his character was much more convincing and real  a tiny man who one feels terrible pity for. Likewise Tim's pain and sense of being overwhelmed by the pointlessness of it all was palatable whereas Jim is far too perky and seems to be wearing it reasonably well.Again this may be part of the longer game-plan as the development of characters over longer US seasons would be difficult if they arrived fully formed but it does the actors a bit of a disservice in this first season. Don't get me wrong though, the first season is still funny  even when it comes over as a bit of a lesser copy, it does still generate laughs and awkwardness. However it is best when it is creating new material totally and worrying less about getting everything the same as the UK original. This is encouraging because, with 4 or 5 seasons now made, it is clear that it must have become its own master now given how little source material there is. Here though it must be said that it is impossible to avoid the US/UK comparison because it is writ large across almost all of the six episodes and, in attempting the same thing, the US version does fall short of the mark  this is not protectionist sentiment, just the way it is.The cast struggle by comparison because of the similarity. I think everyone is good enough to be able to raise their game when the show settles in but in this first season it is hard to avoid the sense of the cast not ""getting it"" in the way the original did. Again, I add the caveat of the longer game plan and the ""pilot"" nature of the first season but I cannot help say that Carell (who I like) is just not as good as Gervias at the pained stuff. He is at his best as the foolish clown but he cannot nail the inner emptiness and pathos that is what we all remember Brent for. Sadly the material makes this weakness more apparent. Wilson is a solid turn but again doesn't compare with the original. Krasinski offers more of a US sitcom role and I think will be good at this but again he struggles with trying to fit into the reproduced material while also having a less developed character. The only person of the whole cast who really nails the pained thing is Fischer as I totally believed the small deaths she suffered with every day in the office  she is excellent here.Season 1 is generally funny and, if I had not seen the original then I would probably have liked it more. However it stays too close to the original, suffering by comparison and also never finding its own voice or direction. I think the potential is there though and will follow this with season 2 to see where it goes and what it does when it has to start to find its own way.",3/15
1,1,6,8,ComedyFan2010,27 December 2018,A hot girl comes to the office to sell purses. Most men in the office are interested in her and Jim asks her out.This episode was a nice finale of the first season. It is kind of weird that there is such thing as coming to an office to sell stuff. Dwight made me laugh so much in this episode when testing the purse by beating it against the table. Michael hitting on Katie was also very well done.,4/6
2,1,6,7,Edvis-1997,24 October 2021,"For me it was just a lack of creation and this episode felt just been here to fill air-time on TV, nothing too special, nothing serious just giggles, I expect more to be honest.",0/1
3,1,6,9,zkonedog,5 July 2019,"For the past few years, I considered the TV series ""Family Guy"" to be the funniest show on the tube for its ability to poke fun at anything and everything. Yet, more than likely due to the rather sick mind of creator Seth McFarlane, that show tends to beat you over the head (sometimes again and again and again) with its jokes in rather crude fashion. It can be hilarious, don't get me wrong, but a show like that can only stay fresh for so long without having to up the ""shock ante"" with every episode.Just recently, though, I discovered ""The Office"" while utilizing a free trial of Netflix and was blown away by the subtleness of the humor that abounds in each and every episode. I had watched bits and pieces of certain episodes in the past, but beginning to watch them in broadcast order really helped me put the pieces together and enjoy every second of each 20-minute episode.Basically, the show is set at the Dunder-Mifflin paper company in Scranton, PA, where a very diverse group of office workers work the 9-5 cubicle life under the ""direction"" of Michael Scott (played by Steve Carell). It's very much like a toned-down, more realistically-funny version of the feature film ""Office Space"". But here's the catch: Michael is, by and large, a complete idiot, and thus the office functions accordingly.In this first season (only six episodes long, likely due to its ""trial run"" status in the U.S. to see if it could duplicate the success of its United Kingdom namesake show), all the building blocks of the show are put in place in terms of character development, relationships, and humor. Really, there are three reasons why the show (right from this very first season) resonated so much with American audiences:First, is the notion that all the characters are so relatable to potential real-life situations. Everyone can relate to the idiot boss (Michael), the office suck-up (Dwight), the ""normal"" or ""cool"" ones (Jim and Pam), the pervert (Kevin) and the tightly-wound frosty woman (Angela), to name just a few. While those characters are of course amped up a bit from what a real office feels like, there still exists that sense that you yourself could just as easily be in the same situation they are.Another reason this show is so successful is the focus on the characters of Jim and Pam. Both are acted extraordinarily by John Krasinski and Jenna Fischer and are truly the heart and soul of the show. Audiences can easily relate to the romantic tension and silly pranks between the two because of what could be called a ""normalcy complex"": they are the two most normal, fun characters on the show, and thus the audience roots for them due to the fact that they represent what we want to be at work. Your heart will break as they both struggle to figure out a relationship that seems destined to be, but at the same time you will also laugh along with them as they pull their silly pranks on various office personnel.Finally, though, what truly sets this show apart from any other comedy series I have previously seen is the fact that storylines are progressed from episode to episode. Unlike some half-hour comedies (like Family Guy) where, by and large, the slate is pretty much wiped clean after every episode, ""The Office"" instead builds on certain plot and character threads to create continuity. Thus, the characters actually grow and learn on screen in front of you, so to speak, and don't just stagnate repeating the same old jokes or gags.Thus, I would pretty much recommend this show to anybody who has ever held a job (not too limiting, huh?!), as you will be able to instantly relate to the kind of antics that transpire.",7/10
4,1,6,8,vivianla,29 April 2020,"A saleswoman named Katy comes in looking to sell purses - she is turned away until the boss sees how she is a hotter Pam. She is wearing tighter clothes, heels, hair is curled and her makeup done. Her back curves are shown and she is showing slight cleavage that gets the males' attention. I like the purple top she has on. The boss tries to attract Katy, giving her coffee and offers to take her home. At last she tells the boss at the very last minute she doesn't need a ride anymore when everyone is at the parking lot and the handsome boy takes her home.",3/6
