,season,episode,Rating,Name,Date,Text,Useful
2,3,9,9,vivianla,28 September 2020,A baby is bounced by its mother. Michael oohs at the baby and then acts childish himself. Michael says milk is needed and it comes from breasts.Jim is dating the pretty girl from Stamford.A phone call is received from Jan who informs that an ex-convict is working which is why Angela from accounting received that money from the government. The group looks around wondering who from Stamford is an ex-prisoner.It turns out to be Martin and Michael informs Dwight. Dwight hilariously has bills peeking from his back pocket and he stands close to Martin.After a long day we see Martin has his things in a box and carries it to the elevator. Michael explains Martin quit and he is glad. Michael is slowly getting each former Stamford employee to quit.,1/5
3,3,9,10,xsilentnone,12 October 2020,"A new guy from Stamford to a convict,
to PRESON MIKE's friend, back to a convict,
Then to kinda of a nuisance, and finally to a quitter.",0/6
4,3,9,10,ezequias-farias,12 December 2020,"Some of the lines on this episode would never ever go live due to the pathetic PC Culture in our culture today where people are hurt by words.
Michael tells the camera ""I just wish Josh had made a more progressive choice like a white guy...""
I miss those old times back in 2000s where people would laugh at the expense of everything. This episode is great in showing how fun the world was where we would laugh at simple stuff that we could carry on and just live with it.",2/12
5,3,9,9,thetrueopm,17 August 2018,"I liked this episode, I didn't like how two characters were gotten rid of in the span of two episodes, I liked Toby's moment at the end, he plays everything as he's the bigger person to micheal, and he is. I loved how he set micheal straight in the end. He's the perfect straight man in the show.",19/23
6,3,9,10,siyarduhoki,15 July 2020,"How on God's green earth is this episode 8.3/10 is beyond logic, the whole episode start to finish is just absolutely mesmerizing and Michael specifically 👌🏻 he seriously nailed it to the coffin.. and to think he never won an emmy for his role, that's a damn shame.",16/18
7,3,9,9,carloss_ed,2 March 2021,"I was rewatching this to see If it hand Ricky's usual writers hand, but it was actually a great episode that fits in well with the other episodes in the series.It's a shame it was the first and the last, except the first episode, which was based on the original UK office series.",1/4
0,3,11,8,ComedyFan2010,30 December 2018,Michael goes on vacation with Jan which he needs to keep secret but he mistakenly sends the picture of them to the wrong address.So now Jan will be dating Michael. I loved her reason why. Pam is so sweet helping Karen and one really feels bad for her. Not the funniest episode but still good.,3/7
1,3,11,8,Edvis-1997,27 October 2021,"Very decent episode. Michael, as always, never learn and screws everything. This particular episode had one key funny moment and they kept talking about it in which didn't get more funnier. The ending was just meh for me.",0/3
2,3,11,9,vivianla,31 October 2020,"Dwight records the meeting and then Jim begins to say things out loud making Dwight look bad such as saying he took off his shirt. The other employees join in.Michael comes back into the office from Jamaica full of energy. He talks to a fellow colleague who seem to understand his comedy. Michael had sex with Jan and they shared the same room. Michael sends an email of a sexy photo of Jan lying topless on her front.Michael has accidentally sent it to packaging, not to Packer and Packer receives the email from someone else. Packer says wow that is hot and asks how could he remove Michael from the photo.Michael runs downstairs and the packaging team all have the photo as well as the office now.Michael checks the warehouse again and the packaging team has printed out a giant version of the photo. They compliment Michael saying he got some corporate booty.Michael has ordered a luau and the party committee team sets to prepare for the night as the party will go on at the same time as inventory.Jan comes to the warehouse and Michael follows her upstairs slowly. Jan sits at his desk and tells Michael that last year so much happened with her divorce and more. Her psychiatrist tells her she needs to go with what she wants and she tells Michael she wants to be with him. Michael is pleasantly but cautiously is surprised. She kisses Michael hard and tells him to meet her at his condo.",3/9
3,3,11,10,xsilentnone,12 October 2020,"The best boss ever has back from his vacation
The best boss ever know just how to spend a unmemorable vacation
The Best Boss Ever
The best boss ever
Michael.",2/8
4,3,11,NA,peacefrog-35822,23 May 2021,"Dunder Mifflin's warehouse only receives and ships paper, which is already packaged. They wouldn't have a ""packaging"" department, which would exist in a factory that produces products. Just shipping and receiving. So the mix up between ""Packer"" and ""packaging"" is a real stretch, a contrivance to set up the mistake in email. Lazy writing.",0/9
0,3,13,10,ComedyFan2010,2 January 2019,"Oscar comes back and gets a welcome party. Michael realizes that he made a mistake firing Dwight.Great episode. Andy annoying Michael was hilarious considering that Michael often does it to others but even for him Andy was too much. The whole talking of his about butt kissing was wonderful and I loved the moment between him and Dwight.Dwight also was great as a Staples salesman who still loves Dunder Mifflin. His comeback makes not only Jim but also all the viewers happy.Angela was also great this episode, so not what we are used to. So one can see what she feels for Dwight and she apparently was worried Michael finds out her and Dwight date. Their handshake at the end was sweet!Pam and Jim's prank on Andy was also good and ended up with a bid surprise. I actually like Andy as a character. Him being so annoying and representing a butt kisser really adds fun to the show. And while I feel bad for Karen I am glad Jim has feelings for Pam. We all know they belong together!",19/24
1,3,13,9,Edvis-1997,28 October 2021,"Well, that's not really suprise, we all knoew she will tell him true and Dwight will come back to his old job. It's just Andy for me... How he's more annoying than Dwight, unbelievable.",1/4
2,3,13,9,vivianla,15 November 2020,"Dwight goes for interviews but he gives three different documents to each hiring manager.He ends up taking a job with Staples saying it is temporary.Andy annoys the whole office including Michael himself.Oscar comes back and they throw a party for him. Angela goes into Michael's office and admits Dwight went to corporate that morning for her because she did not hand in something on time. It is snowing outside.During the party Michael encourages Pam to shake her breasts as he shakes maracas in front of his chest. Pam refuses but Phyllis shakes her chest. Michael slowly leaves, repulsed.Michael gets angry realizing Andy was kissing his butt after Jim mentions Andy copies his boss casually. Michael drives to Staples to get Dwight back. Andy has been sent to an anger management program after Michael had a chat with corporate. Andy tells us he does personality mirroring and we see him imitate the woman.",3/8
3,3,13,10,discgolf-73334,20 October 2021,"The Return is on of my favorite episodes of the entire show. Ed Helms is perfect as Andy and as annoying as he is, it's one of the funniest episodes!Then comes the wall punch, a jaw dropping moment of the show that is always hilarious.",5/8
4,3,13,9,themightykazoo-30763,20 December 2019,Can't stand Andy. Glad that he was gone for a while after this episode,29/45
5,3,13,10,dmdebruyn,24 November 2018,"Season 3 of The Office takes the show's main characters into very complicated terrain as each of them struggles to navigate the rough waters that make up his or her story.
1. Jim moves to Stamford but then moves back after it closes down, prompting a merger with Dunder Mifflin that places new characters, Karen Filippelli and Andy Bernard, among the office regulars. Jim starts a relationship with Karen but still has feelings for Pam.
2. Dwight's his usual oddball self, secretly in a relationship with Angela, and still Dundee Mifflin's top salesman. With Andy's entrance into Dunder Mifflin, his ways of sucking up to Michael make him a bigger threat to Dwight than Jim, and they become mortal enemies
3. And Pam, heartbroken as she is, managed to maintain her perky personality in the workplace
4. And of course, Michael Scott himself, struggling to find happiness while striving to remain the world's greatest boss at Dunder Mifflin.I'll leave it at those four for now, as I've gotta get to the reviewIn this episode ""The Return,"" Dwight has left Dunder Mifflin (more on that in the previous episode) and is now working at a Staples store, while the rest of the office now has to put up with Andy's annoying antics. Through various changes in the mood and organization of the workplace (surplus of clients, wilted plants, disorganized desk toys), everyone suddenly realizes how much Dwight meant to Dunder Mifflin. It's also bad timing, as Oscar has just returned to the office after a ""gay-cation"" that lasted half the season. Andy, reveling in Dwight's absence, continues trying to suck up to Michael and manages to annoy everyone around him, and creeping out Michael himself. He also may or may not realize how much this reflects his own antics in previous seasons (""I don't understand how someone could have so little self-awareness""). In the end, Michael realizes his mistake, and brings Dwight back to a grateful Dunder Mifflin. As for Andy, he gets his comeuppance after a prank by Jim and Pam (back at it again (yes!)) which then leads to a rejection by Michael that leaves us thankful and then in stitches, as this is followed by a crazed wall punch by Andy Bernard himself (exposed!). There's only one thing to say for all of this: Dwight Schrute FOREVER!In this episode, almost all of the characters' narrative story arcs for season 3 reach a climax, and what a climax it is.
1. Jim is back to his prank-pulling self, and really still has feelings for Pam, once again his accomplice in his pranks when no one else will be (no surprise by Ryan, but a real blunder on Karen's part)
2. Pam remains perky and helpful as ever, even attempting to console Angela in a heartfelt exchange where she sort of admits her feelings for Dwight, bringing us to:
3. Angela shows her sentimental side
4. Dwight remains his Dwight Schrute self, even bringing his dedicated ways into his new workplace, where it's not accepted unfortunately for him. Still, as always, Dwight perseveres, and gives us a perfect description of himself in the process (""How would I describe myself? Three words: Hardworking, alpha-male, jackhammer... merciless... insatiable..."").
5. And last but not least, Michael Scott himself. While his relationship with Dwight was certainly not his cup of tea, Michael realizes what Dwight means to the company, his surroundings, and him, even preferring him over Andy. When he brings Dwight back, not only does he admit he made a mistake and fixes it (""It takes a big man to admit his mistake. And I am that big man""), but he also takes a big step in the right direction for his fellow peers and all who view him as Michael Scott: The World's Greatest Boss.For bringing us stunning narrative turning points for the characters as well as tons of hilarious memorable moments, I call ""The Return"" one of the show's shining achievements and up there among the all-time best episodes of The Office.
Three cheers for Dunder Mifflin!",24/28
6,3,13,6,sales-615,23 January 2007,"VERY SLIGHT SPOILERThis episode in part follows the exploits of Dwayne in his endevours outside of Dunder Mifflin along with the return of Oscar, hence the episode title.Not a bad episode but not particularly good either when you look back at a very strong season 2. They embarked on territory that the English version hadn't when they decided on a longer season 2 and now season 3 and to be fair they have done pretty well. They are always standing slightly in the shadow (as every UK poster will tell you along with burning an efigy of Micheal Scott) and have gone further in the development of the series.I enjoy this series but I do hope that they wrap it up after this one.",6/72
0,3,15,8,ComedyFan2010,2 January 2019,"It is Phyllis' wedding and Michael tries hard to participate.Michael being wonderful in this episode again trying to make himself a highlight of the wedding. He is just hilarious. Him in the photos, announcing them as a couple and even getting kicked out.Another great thing was that this was all Pam's wedding ideas. And her and Roy at the end dancing was nice. While I want to see Pam with Jim I do have a soft spot for her and Roy because of how long their relationship was. Even though they don't really belong together they do love each other in a way.",18/20
1,3,15,8,Edvis-1997,29 October 2021,"It was decent episode, maybe not the funniest one but still interesting to watch how Boss screwing everything again, lol. Ending was really cute tho so can't complain a lot.",1/4
2,3,15,8,vivianla,18 November 2020,This episode was slightly underwhelming especially for a big event like a wedding. Michael was a bit too much even for him during this wedding.Michael goes in and offers to give advice for Phyllis's wedding night sex.Pam is shocked to find out that all her ideas for her wedding were stolen.Pam's ex tries to be nice and make things up.Jim states he is happy that he is with Karen and watches with his eyes light up as she sings.The songs during the wedding were mostly by The Police and there was one slow song I liked.Pam's ex asks her to dance - his look and voice was good - and they dance outside.,4/10
3,3,15,10,Faristuta,27 February 2020,"""Did you pass wind Phyllis?""
One of the top episodes of the series.",6/11
4,3,15,5,fagurado,19 January 2022,"Before I start: the use of the word ""retard"" in this review is a reference to the movie Tropic Thunder, so even if it's a little bit crass....humor me, please. Danke.Back to the show. This is another one of those episodes that makes me go ""oh no, they went this low?""Part of the attractive of the show is that we believe this is a documentary, but when they make Dwight or Michael do straight out retarded stuff, then that's when they lose me. In the last episode Dwight tells to the camera ""I don't think that is the real Benjamin Franklin"". Now, Dwight is a bit of a doofus, but he has a job, he owns a house, and he has a woman. He's not a retarded person. He's not that stupid as to believe that this person is the same as someone who lived 300 years ago.And then in the current episode, episode 15, the sight of Michael dragging the wheelchair with the brakes on, stupidly getting in line with the other bestmen, and having other people tolerate this absolutely ridiculous behaviour...it requires the entire cast to go retard.I didn't want to watch The Retard Office.",1/3
5,3,15,10,emhenry1990,18 January 2019,This episode made me laugh so hard I cried. I completely lost it when Michael had to pull Phyllis' father's wheelchair down the aisle. I also felt bad for him when he was the only one kicked out from the wedding. This episode had some poignant moments and had some funny moments too.,15/19
6,3,15,9,coreyharrison-37866,2 July 2020,Oh boy. This has some seems that are hard to watch but still funny.,9/14
0,3,17,9,ComedyFan2010,2 January 2019,"Michael and Jan go to a cocktail party at Wallace's. Pam makes a confession to Roy which makes him mad.I feel bad both for Jan and Michael. He doesn't get the love he wants and for her it must be pretty embarrassing to be with him.Dwight was great with his house inspection that made his party today. Lots of small moments too like Creed, who is a king of those.And doesn't one want right away to see what happens between Roy and Jim! Karen pranked him pretty well too.",15/18
1,3,17,7,Edvis-1997,29 October 2021,"Is it me or something but this episode was very bland. Main idea wasn't that interesting to make whole episode about it, just ending scene gave it some points, everything else just meh.",2/8
2,3,17,8,vivianla,18 November 2020,The managers have a party with the CFO (Jan's boss). Jan and Michael are now taking their relationship publicly.Jim and Karen are at the party too as well as Dwight.Karen compliments the owner saying their home is beautiful. Dwight asks the owners the square foot area and Michael says that is not appropriate but then proceeds to ask how much their home costs. Dwight touches everything and inspects the home. He goes upstairs even in the bedrooms...Pam asks her bf to join her at happy hour. The bf doesn't want to at first but Pam says directly if he is to be her bf he has to do bf things. Pam tells the camera she will start being direct and saying things that she wants.The HR guy overhears Pam saying the ducky is cute and he takes out cash to try to win it for her secretly. He hands the duck to her and she asks him doesn't he have a daughter? It was so sweet he did that.At happy hour they play a game where they thud the tables and then put their hands up.Jan wants sex in the bathroom of the home at the party but Michael is not into it right then and there.Pam's bf gets angry when she tells him she kissed Jim. They break up and him and his brother start destroying stuff.,2/7
3,3,17,10,xsilentnone,17 October 2020,"Just x loody stuff and
Nothing else.
Yeah
Nothing thing no
XXX",0/13
0,3,19,10,ComedyFan2010,2 January 2019,"Michael is upset when Dwight tells him that the work on in the office isn't as dangerous as warehouse and tries to make a visual presentation on suicide.Another amazing episode. The whole thing with Michael on the roof was great just like the presentation in the warehouse that was held pretty much specifically for him. And there are always as in any episode small things that add so much to it, like the bet scenes with Creed eating a potato and Kelly talking about Netflix. And Stanley finding a watermelon on his car.",13/15
1,3,19,8,Edvis-1997,29 October 2021,"Comparing this episode with previous one this looks pretty bland, tho, it wasn't that bad. I liked how Michael kept interrupting in whole safety training part at warehouse, everything else wasn't for me, sorry.",1/6
2,3,19,8,vivianla,19 November 2020,"Darryl got hurt because Michael pulled out a ladder from under him. Now he is explaining the dangers of the warehouse. There is one machine that can cut off your arm. 10 people per year have gotten hurt by it statistically.Michael gets annoyed when Darryl says they have a nice, cushy, nerfy life up here.Michal prepares a suicide demonstration and gets Dwight to go get a bouncy castle and watermelons.The office workers are led out by Dwight and they realize he could seriously die by pretending to die. They encourage Michael off the roof. Darryl says he did not say you have nothing to live for.",1/4
3,3,19,10,matthewsweet-55214,14 August 2018,"Omg what can I say about this episode, well a lot of things because it's one of the best episodes of The Office. So Michael is upset with the warehouse workers because they tease him that an office job will never be as dangerous as working at the warehouse. So Michael being his smart self hatching a plan to pretend to kill himself that could kill himself. Everything about this episodes works from the lines, to the warehouse safety tour, and of course the pretend suicide. 10/10 for me.",19/22
4,3,19,9,vanessalangford,5 December 2021,"I loved this whole episode, but there is a golden moment when Dwight and Mike experiment with a watermelon, the panic on Mike's face is priceless. It gets me every time - and that's why this series is great, relatable & laugh out loud comedy.",1/2
0,3,21,9,ComedyFan2010,2 January 2019,After Phyllis is flashed Michael makes a women appreciation day where they help him to break up with Jan.One really feels for Michael in this episode. He really wants to be loved and Jan is not right for him when it comes to it. And he made us laugh again of course. In the meantime guys in the office also had some fun time in women bathroom which Creed mad even better. And making the flashing guy picture look like Dwight was just great!,14/17
1,3,21,8,Edvis-1997,29 October 2021,"The beginning of this episode started with funny scene when Michael was making jokes but the middle was pretty bland and then again ending was good, so I would say it was 9/6/9 so can't give it more than 8.",1/5
2,3,21,7,vivianla,20 November 2020,Phyllis enters the office stating a man flashed her. Pam says she wished that the man flashed her when she was with her ex. Then she says out loud that her ex would not have liked her seeing Jim's.This episode was anxiety personally for me and uncomfortable which is why I rated it lower than it should. (Rating is more for myself).Michael says he did not like being flashed by Meredith at the Christmas party and Angela says what a surprise. Lol.Michael refers to Pam and Karen as the real women and Phyllis is not really. He talks about society and how skinny and tall women are seen as ideal. The women in the office aren't even that skinny he says and everyone looks at Pam.Michael decides to have a women's appreciation day and take all the female workers out to the mall.The men stay behind and the bald man tells Jim he is curious about the women's bathroom - it is every man's fantasy. Jim says he thinks he means the girls' locker room (because women in all states of undress?). The guys lounge in the women's washroom.At the mall Michael buys junk food and says he hopes no one is on a diet...He then offers to buy everyone one thing from Victoria's Secret and we see Alessandra Ambrosio on a poster behind him. Kelly is excited and runs in. Phyllis carries some underwear and then Karen asks for her opinion on some unlined lace underwear. Phyllis says that Jim would love that and Pam overhears and widens her eyes. Pam says she does not need anything too sexy because she is single so she is going to pick this bathrobe.They drive back to the office and carry the older style Victoria's Secret bags. In the elevator Jim is with Karen with her VS bag and Pam is there when the doors open with hers.Michael breaks up with Jan over the phone.,3/13
3,3,21,10,Faristuta,6 July 2018,"This episode captured me. Even though Michael is indeed misogynistic, he reveals he has a big heart and only wishes these women the best especially with what he said toward the end.",24/28
